CREATE OR REPLACE FUNCTION atsort( a text[])
 RETURNS text[]
 LANGUAGE sql
 IMMUTABLE  STRICT
AS $function$
  select array(select unnest($1) order by 1)
$function$
;
create server localredis foreign data wrapper redis_fdw;
create user mapping for public server localredis;
-- tables for all 5 data types (4 structured plus scalar)
create foreign table db15(key text, value text)
       server localredis
       options (database '15');
create foreign table db15_hash(key text, value text)
       server localredis
       options (database '15', tabletype 'hash');
create foreign table db15_set(key text, value text)
       server localredis
       options (database '15', tabletype 'set');
create foreign table db15_list(key text, value text)
       server localredis
       options (database '15', tabletype 'list');
create foreign table db15_zset(key text, value text)
       server localredis
       options (database '15', tabletype 'zset');
-- make sure they are all empty - if any are not stop the script right now
\set ON_ERROR_STOP
do $$
  declare
    rows bigint;
  begin
    select into rows
        (select count(*) from db15) +
        (select count(*) from db15_hash) +
        (select count(*) from db15_set) +
        (select count(*) from db15_list) +
        (select count(*) from db15_zset);
    if rows > 0
    then
       raise EXCEPTION 'db 15 not empty';
    end if;
  end;
$$;
\unset ON_ERROR_STOP
-- ok, empty, so now run the setup script
\! redis-cli < test/sql/redis_setup
OK
OK
OK
8
5
6
4
OK
OK
6
6
2
2
2
2
select * from db15 order by key;
 key | value  
-----+--------
 baz | blurfl
 foo | bar
(2 rows)

select * from db15 where key = 'foo';
 key | value 
-----+-------
 foo | bar
(1 row)

-- hash
create foreign table db15_hash_prefix(key text, value text)
       server localredis
       options (tabletype 'hash', tablekeyprefix 'hash', database '15');
create foreign table db15_hash_prefix_array(key text, value text[])
       server localredis
       options (tabletype 'hash', tablekeyprefix 'hash', database '15');
create foreign table db15_hash_keyset_array(key text, value text[])
       server localredis
       options (tabletype 'hash', tablekeyset 'hkeys', database '15');
select * from db15_hash_prefix order by key;
  key  |                   value                   
-------+-------------------------------------------
 hash1 | {"k1","v1","k2","v2","k3","v3","k4","v4"}
 hash2 | {"k1","v5","k2","v6","k3","v7","k4","v8"}
(2 rows)

select * from db15_hash_prefix where key = 'hash1';
  key  |                   value                   
-------+-------------------------------------------
 hash1 | {"k1","v1","k2","v2","k3","v3","k4","v4"}
(1 row)

select * from db15_hash_prefix_array order by key;
  key  |           value           
-------+---------------------------
 hash1 | {k1,v1,k2,v2,k3,v3,k4,v4}
 hash2 | {k1,v5,k2,v6,k3,v7,k4,v8}
(2 rows)

select * from db15_hash_prefix_array where key = 'hash1';
  key  |           value           
-------+---------------------------
 hash1 | {k1,v1,k2,v2,k3,v3,k4,v4}
(1 row)

select * from db15_hash_keyset_array order by key;
  key  |           value           
-------+---------------------------
 hash1 | {k1,v1,k2,v2,k3,v3,k4,v4}
 hash2 | {k1,v5,k2,v6,k3,v7,k4,v8}
(2 rows)

select * from db15_hash_keyset_array where key = 'hash1';
  key  |           value           
-------+---------------------------
 hash1 | {k1,v1,k2,v2,k3,v3,k4,v4}
(1 row)

-- a couple of nifty things we an do with hash tables
select key, hstore(value) from db15_hash_prefix_array order by key;
  key  |                     hstore                     
-------+------------------------------------------------
 hash1 | "k1"=>"v1", "k2"=>"v2", "k3"=>"v3", "k4"=>"v4"
 hash2 | "k1"=>"v5", "k2"=>"v6", "k3"=>"v7", "k4"=>"v8"
(2 rows)

create type atab as (k1 text, k2 text, k3 text);
select key, (populate_record(null::atab, hstore(value))).*
from db15_hash_prefix_array
order by key;
  key  | k1 | k2 | k3 
-------+----+----+----
 hash1 | v1 | v2 | v3
 hash2 | v5 | v6 | v7
(2 rows)

-- set
create foreign table db15_set_prefix(key text, value text)
       server localredis
       options (tabletype 'set', tablekeyprefix 'set', database '15');
create foreign table db15_set_prefix_array(key text, value text[])
       server localredis
       options (tabletype 'set', tablekeyprefix 'set', database '15');
create foreign table db15_set_keyset_array(key text, value text[])
       server localredis
       options (tabletype 'set', tablekeyset 'skeys', database '15');
-- need to use atsort() on set results to get predicable output
-- since redis will give them back in arbitrary order
-- means we can't show the actual value for db15_set_prefix which has it as a
-- single text field
select key, atsort(value::text[]) as value from db15_set_prefix order by key;
 key  |           value           
------+---------------------------
 set1 | {m1,m2,m3,m4,m5,m6,m7,m8}
 set2 | {m10,m11,m12,m8,m9}
(2 rows)

select key, atsort(value::text[]) as value from db15_set_prefix where key = 'set1';
 key  |           value           
------+---------------------------
 set1 | {m1,m2,m3,m4,m5,m6,m7,m8}
(1 row)

select key, atsort(value) as value from db15_set_prefix_array order by key;
 key  |           value           
------+---------------------------
 set1 | {m1,m2,m3,m4,m5,m6,m7,m8}
 set2 | {m10,m11,m12,m8,m9}
(2 rows)

select key, atsort(value) as value from db15_set_prefix_array where key = 'set1';
 key  |           value           
------+---------------------------
 set1 | {m1,m2,m3,m4,m5,m6,m7,m8}
(1 row)

select key, atsort(value) as value from db15_set_keyset_array order by key;
 key  |           value           
------+---------------------------
 set1 | {m1,m2,m3,m4,m5,m6,m7,m8}
 set2 | {m10,m11,m12,m8,m9}
(2 rows)

select key, atsort(value) as value from db15_set_keyset_array where key = 'set1';
 key  |           value           
------+---------------------------
 set1 | {m1,m2,m3,m4,m5,m6,m7,m8}
(1 row)

-- list
create foreign table db15_list_prefix(key text, value text)
       server localredis
       options (tabletype 'list', tablekeyprefix 'list', database '15');
create foreign table db15_list_prefix_array(key text, value text[])
       server localredis
       options (tabletype 'list', tablekeyprefix 'list', database '15');
create foreign table db15_list_keyset_array(key text, value text[])
       server localredis
       options (tabletype 'list', tablekeyset 'lkeys', database '15');
select * from db15_list_prefix order by key;
  key  |              value              
-------+---------------------------------
 list1 | {"e6","e5","e4","e3","e2","e1"}
 list2 | {"e10","e9","e8","e7"}
(2 rows)

select * from db15_list_prefix where key = 'list1';
  key  |              value              
-------+---------------------------------
 list1 | {"e6","e5","e4","e3","e2","e1"}
(1 row)

select * from db15_list_prefix_array order by key;
  key  |        value        
-------+---------------------
 list1 | {e6,e5,e4,e3,e2,e1}
 list2 | {e10,e9,e8,e7}
(2 rows)

select * from db15_list_prefix_array where key = 'list1';
  key  |        value        
-------+---------------------
 list1 | {e6,e5,e4,e3,e2,e1}
(1 row)

select * from db15_list_keyset_array order by key;
  key  |        value        
-------+---------------------
 list1 | {e6,e5,e4,e3,e2,e1}
 list2 | {e10,e9,e8,e7}
(2 rows)

select * from db15_list_keyset_array where key = 'list1';
  key  |        value        
-------+---------------------
 list1 | {e6,e5,e4,e3,e2,e1}
(1 row)

-- zset
create foreign table db15_zset_prefix(key text, value text)
       server localredis
       options (tabletype 'zset', tablekeyprefix 'zset', database '15');
create foreign table db15_zset_prefix_array(key text, value text[])
       server localredis
       options (tabletype 'zset', tablekeyprefix 'zset', database '15');
create foreign table db15_zset_keyset_array(key text, value text[])
       server localredis
       options (tabletype 'zset', tablekeyset 'zkeys', database '15');
select * from db15_zset_prefix order by key;
  key  |               value                
-------+------------------------------------
 zset1 | {"z1","z2","z3","z4","z5","z6"}
 zset2 | {"z7","z8","z9","z10","z11","z12"}
(2 rows)

select * from db15_zset_prefix where key = 'zset1';
  key  |              value              
-------+---------------------------------
 zset1 | {"z1","z2","z3","z4","z5","z6"}
(1 row)

select * from db15_zset_prefix_array order by key;
  key  |         value          
-------+------------------------
 zset1 | {z1,z2,z3,z4,z5,z6}
 zset2 | {z7,z8,z9,z10,z11,z12}
(2 rows)

select * from db15_zset_prefix_array where key = 'zset1';
  key  |        value        
-------+---------------------
 zset1 | {z1,z2,z3,z4,z5,z6}
(1 row)

select * from db15_zset_keyset_array order by key;
  key  |         value          
-------+------------------------
 zset1 | {z1,z2,z3,z4,z5,z6}
 zset2 | {z7,z8,z9,z10,z11,z12}
(2 rows)

select * from db15_zset_keyset_array where key = 'zset1';
  key  |        value        
-------+---------------------
 zset1 | {z1,z2,z3,z4,z5,z6}
(1 row)

-- singleton scalar
create foreign table db15_1key(value text)
       server localredis
       options (singleton_key 'foo', database '15');
select * from db15_1key;
 value 
-------
 bar
(1 row)

-- singleton hash
create foreign table db15_1key_hash(key text, value text)
       server localredis
       options (tabletype 'hash', singleton_key 'hash1', database '15');
select * from db15_1key_hash order by key;
 key | value 
-----+-------
 k1  | v1
 k2  | v2
 k3  | v3
 k4  | v4
(4 rows)

-- singleton set
create foreign table db15_1key_set(value text)
       server localredis
       options (tabletype 'set', singleton_key 'set1', database '15');
select * from db15_1key_set order by value;
 value 
-------
 m1
 m2
 m3
 m4
 m5
 m6
 m7
 m8
(8 rows)

-- singleton list
create foreign table db15_1key_list(value text)
       server localredis
       options (tabletype 'list', singleton_key 'list1', database '15');
select * from db15_1key_list order by value;
 value 
-------
 e1
 e2
 e3
 e4
 e5
 e6
(6 rows)

-- singleton zset
create foreign table db15_1key_zset(value text)
       server localredis
       options (tabletype 'zset', singleton_key 'zset1', database '15');
select * from db15_1key_zset order by value;
 value 
-------
 z1
 z2
 z3
 z4
 z5
 z6
(6 rows)

-- singleton zset with scores
create foreign table db15_1key_zset_scores(value text, score numeric)
       server localredis
       options (tabletype 'zset', singleton_key 'zset1', database '15');
select * from db15_1key_zset_scores order by score desc;
 value | score 
-------+-------
 z6    |     6
 z5    |     5
 z4    |     4
 z3    |     3
 z2    |     2
 z1    |     1
(6 rows)

-- insert delete update
-- first clean the database again
\! redis-cli < test/sql/redis_clean
OK
OK
-- singleton scalar table
create foreign table db15_w_1key_scalar(val text)
       server localredis
       options (singleton_key 'w_1key_scalar', database '15');
select * from db15_w_1key_scalar;
 val 
-----
(0 rows)

insert into db15_w_1key_scalar values ('only row');
select * from db15_w_1key_scalar;
   val    
----------
 only row
(1 row)

insert into db15_w_1key_scalar values ('only row');
ERROR:  key already exists: w_1key_scalar
delete from db15_w_1key_scalar where val = 'not only row';
select * from db15_w_1key_scalar;
   val    
----------
 only row
(1 row)

update db15_w_1key_scalar set val = 'new scalar val';
select * from db15_w_1key_scalar;
      val       
----------------
 new scalar val
(1 row)

delete from db15_w_1key_scalar;
select * from db15_w_1key_scalar;
 val 
-----
(0 rows)

-- singleton hash
create foreign table db15_w_1key_hash(key text, val text)
       server localredis
       options (singleton_key 'w_1key_hash', tabletype 'hash', database '15');
select * from db15_w_1key_hash;
 key | val 
-----+-----
(0 rows)

insert into db15_w_1key_hash values ('a','b'), ('c','d'),('e','f');
select * from db15_w_1key_hash order by key;
 key | val 
-----+-----
 a   | b
 c   | d
 e   | f
(3 rows)

insert into db15_w_1key_hash values ('a','b');
ERROR:  key already exists: a
delete from db15_w_1key_hash where key = 'a';
delete from db15_w_1key_hash where key = 'a';
select * from db15_w_1key_hash order by key;
 key | val 
-----+-----
 c   | d
 e   | f
(2 rows)

update db15_w_1key_hash set key = 'x', val = 'y' where key = 'c';
select * from db15_w_1key_hash order by key;
 key | val 
-----+-----
 e   | f
 x   | y
(2 rows)

update db15_w_1key_hash set val = 'z' where key = 'e';
select * from db15_w_1key_hash order by key;
 key | val 
-----+-----
 e   | z
 x   | y
(2 rows)

update db15_w_1key_hash set key = 'w' where key = 'e';
select * from db15_w_1key_hash order by key;
 key | val 
-----+-----
 w   | z
 x   | y
(2 rows)

-- a key-only UPDATE re-stores the existing value using its full Redis length,
-- so a value containing an embedded NUL must survive byte-for-byte (copying it
-- with pstrdup would truncate at the NUL while the length stayed full, reading
-- past the buffer and corrupting the value).  Seed a binary value plus a
-- pristine copy directly in Redis, rename the field via the FDW, then compare
-- server-side.
\! printf 'ab\000cdefghij' | redis-cli -n 15 -x hset w_1key_hash binkey
1
\! printf 'ab\000cdefghij' | redis-cli -n 15 -x hset w_1key_hash binkey_orig
1
update db15_w_1key_hash set key = 'binkey2' where key = 'binkey';
\! redis-cli -n 15 eval "return (redis.call('HGET',KEYS[1],ARGV[1]) == redis.call('HGET',KEYS[1],ARGV[2])) and 'value preserved' or 'value CORRUPTED'" 1 w_1key_hash binkey2 binkey_orig
value preserved
-- singleton list
create foreign table db15_w_1key_list(val text)
       server localredis
       options (singleton_key 'w_1key_list', tabletype 'list', database '15');
select * from db15_w_1key_list;
 val 
-----
(0 rows)

insert into db15_w_1key_list values ('a'), ('c'),('e');
-- for lists the order should (must) be determinate
select * from db15_w_1key_list /* order by val */ ;
 val 
-----
 a
 c
 e
(3 rows)

delete from db15_w_1key_list where val = 'a';
ERROR:  delete not supported for this type of table
delete from db15_w_1key_list where val = 'z';
ERROR:  delete not supported for this type of table
insert into db15_w_1key_list values ('b'), ('d'),('f'),('a'); -- dups allowed here
select * from db15_w_1key_list /* order by val */;
 val 
-----
 a
 c
 e
 b
 d
 f
 a
(7 rows)

update db15_w_1key_list set val = 'y';
ERROR:  update not supported for this type of table
-- singleton set
create foreign table db15_w_1key_set(key text)
       server localredis
       options (singleton_key 'w_1key_set', tabletype 'set', database '15');
select * from db15_w_1key_set;
 key 
-----
(0 rows)

insert into db15_w_1key_set values ('a'), ('c'),('e');
select * from db15_w_1key_set order by key;
 key 
-----
 a
 c
 e
(3 rows)

insert into db15_w_1key_set values ('a'); -- error - dup
ERROR:  key already exists: a
delete from db15_w_1key_set where key = 'c';
select * from db15_w_1key_set order by key;
 key 
-----
 a
 e
(2 rows)

update db15_w_1key_set set key = 'x' where key = 'e';
select * from db15_w_1key_set order by key;
 key 
-----
 a
 x
(2 rows)

-- singleton zset with scores
create foreign table db15_w_1key_zset(key text, priority numeric)
       server localredis
       options (singleton_key 'w_1key_zset', tabletype 'zset', database '15');
select * from db15_w_1key_zset;
 key | priority 
-----+----------
(0 rows)

insert into db15_w_1key_zset values ('a',1), ('c',5),('e',-5), ('h',10);
select * from db15_w_1key_zset order by priority;
 key | priority 
-----+----------
 e   |       -5
 a   |        1
 c   |        5
 h   |       10
(4 rows)

insert into db15_w_1key_zset values ('a',99);
ERROR:  key already exists: a
delete from db15_w_1key_zset where key = 'a';
select * from db15_w_1key_zset order by priority;
 key | priority 
-----+----------
 e   |       -5
 c   |        5
 h   |       10
(3 rows)

delete from db15_w_1key_zset where priority = '5';
select * from db15_w_1key_zset order by priority;
 key | priority 
-----+----------
 e   |       -5
 h   |       10
(2 rows)

update db15_w_1key_zset set key = 'x', priority = 99 where priority = '-5';
select * from db15_w_1key_zset order by priority;
 key | priority 
-----+----------
 h   |       10
 x   |       99
(2 rows)

update db15_w_1key_zset set key = 'y' where key = 'h';
select * from db15_w_1key_zset order by priority;
 key | priority 
-----+----------
 y   |       10
 x   |       99
(2 rows)

update db15_w_1key_zset set priority = 20 where key = 'y';
select * from db15_w_1key_zset order by priority;
 key | priority 
-----+----------
 y   |       20
 x   |       99
(2 rows)

-- singleton zset no scores
-- use set from last step
delete from db15_w_1key_zset;
insert into db15_w_1key_zset values ('e',-5);
create foreign table db15_w_1key_zsetx(key text)
       server localredis
       options (singleton_key 'w_1key_zset', tabletype 'zset', database '15');
select * from db15_w_1key_zsetx;
 key 
-----
 e
(1 row)

insert into db15_w_1key_zsetx values ('a'), ('c'),('e'); -- can't insert
ERROR:  operation not supported for singleton zset table without priorities column
update db15_w_1key_zsetx set key = 'z' where key = 'e';
select * from db15_w_1key_zsetx order by key;
 key 
-----
 z
(1 row)

delete from db15_w_1key_zsetx where key = 'z';
select * from db15_w_1key_zsetx order by key;
 key 
-----
(0 rows)

-- non-singleton scalar table no prefix no keyset
create foreign table db15_w_scalar(key text, val text)
       server localredis
       options (database '15');
select * from db15_w_scalar;
 key | val 
-----+-----
(0 rows)

insert into db15_w_scalar values ('a_ws','b'), ('c_ws','d'),('e_ws','f');
select * from db15_w_scalar order by key;
 key  | val 
------+-----
 a_ws | b
 c_ws | d
 e_ws | f
(3 rows)

delete from db15_w_scalar where key = 'a_ws';
select * from db15_w_scalar order by key;
 key  | val 
------+-----
 c_ws | d
 e_ws | f
(2 rows)

update db15_w_scalar set key = 'x_ws', val='y' where key = 'e_ws';
select * from db15_w_scalar order by key;
 key  | val 
------+-----
 c_ws | d
 x_ws | y
(2 rows)

update db15_w_scalar set key = 'z_ws' where key = 'c_ws';
select * from db15_w_scalar order by key;
 key  | val 
------+-----
 x_ws | y
 z_ws | d
(2 rows)

update db15_w_scalar set val = 'z' where key = 'z_ws';
select * from db15_w_scalar order by key;
 key  | val 
------+-----
 x_ws | y
 z_ws | z
(2 rows)

/*
-- don't delete the whole namespace
 delete from db15_w_scalar;

select * from db15_w_scalar;
*/
-- non-singleton scalar table keyprefix
create foreign table db15_w_scalar_pfx(key text, val text)
       server localredis
       options (database '15', tablekeyprefix 'w_scalar_');
select * from db15_w_scalar_pfx;
 key | val 
-----+-----
(0 rows)

insert into db15_w_scalar_pfx values ('w_scalar_a','b'), ('w_scalar_c','d'),('w_scalar_e','f');
insert into db15_w_scalar_pfx values ('x','y'); -- prefix error
ERROR:  key 'x' does not match table key prefix 'w_scalar_'
-- a key that is a genuine (but shorter) prefix of the table's configured
-- key prefix must still be rejected as a mismatch
insert into db15_w_scalar_pfx values ('w','y'); -- prefix error, key shorter than prefix
ERROR:  key 'w' does not match table key prefix 'w_scalar_'
insert into db15_w_scalar_pfx values ('w_scalar_a','x'); -- dup error
ERROR:  key already exists: w_scalar_a
select * from db15_w_scalar_pfx order by key;
    key     | val 
------------+-----
 w_scalar_a | b
 w_scalar_c | d
 w_scalar_e | f
(3 rows)

delete from db15_w_scalar_pfx where key = 'w_scalar_a';
select * from db15_w_scalar_pfx order by key;
    key     | val 
------------+-----
 w_scalar_c | d
 w_scalar_e | f
(2 rows)

update db15_w_scalar_pfx set key = 'x', val = 'y' where key = 'w_scalar_c'; -- prefix err
ERROR:  key prefix condition violation: x
update db15_w_scalar_pfx set key = 'x'  where key = 'w_scalar_c'; -- prefix err
ERROR:  key prefix condition violation: x
update db15_w_scalar_pfx set key = 'w_scalar_x', val = 'y' where key = 'w_scalar_c';
select * from db15_w_scalar_pfx order by key;
    key     | val 
------------+-----
 w_scalar_e | f
 w_scalar_x | y
(2 rows)

update db15_w_scalar_pfx set key = 'w_scalar_z' where key = 'w_scalar_x';
select * from db15_w_scalar_pfx order by key;
    key     | val 
------------+-----
 w_scalar_e | f
 w_scalar_z | y
(2 rows)

update db15_w_scalar_pfx set val = 'w' where key = 'w_scalar_e';
select * from db15_w_scalar_pfx order by key;
    key     | val 
------------+-----
 w_scalar_e | w
 w_scalar_z | y
(2 rows)

delete from db15_w_scalar_pfx;
select * from db15_w_scalar_pfx order by key;
 key | val 
-----+-----
(0 rows)

-- a name-typed key column round-trips correctly
create foreign table db15_nametest(key name, val text)
       server localredis
       options (database '15', tablekeyprefix 'nametest_');
insert into db15_nametest values ('nametest_a', 'v1'), ('nametest_b', 'v2');
select * from db15_nametest order by key;
    key     | val 
------------+-----
 nametest_a | v1
 nametest_b | v2
(2 rows)

delete from db15_nametest;
drop foreign table db15_nametest;
-- non-singleton scalar table keyset
create foreign table db15_w_scalar_kset(key text, val text)
       server localredis
       options (database '15', tablekeyset 'w_scalar_kset');
select * from db15_w_scalar_kset order by key;
 key | val 
-----+-----
(0 rows)

insert into db15_w_scalar_kset values ('a_wsks','b'), ('c_wsks','d'),('e_wsks','f');
insert into db15_w_scalar_kset values ('a_wsks','x'); -- dup error
ERROR:  key already exists: a_wsks
select * from db15_w_scalar_kset order by key;
  key   | val 
--------+-----
 a_wsks | b
 c_wsks | d
 e_wsks | f
(3 rows)

delete from db15_w_scalar_kset where key = 'a_wsks';
select * from db15_w_scalar_kset order by key;
  key   | val 
--------+-----
 c_wsks | d
 e_wsks | f
(2 rows)

update db15_w_scalar_kset set key = 'x_wsks', val = 'y' where key = 'c_wsks';
select * from db15_w_scalar_kset order by key;
  key   | val 
--------+-----
 e_wsks | f
 x_wsks | y
(2 rows)

update db15_w_scalar_kset set key = 'z_wsks' where key = 'x_wsks';
select * from db15_w_scalar_kset order by key;
  key   | val 
--------+-----
 e_wsks | f
 z_wsks | y
(2 rows)

update db15_w_scalar_kset set val = 'w' where key = 'e_wsks';
select * from db15_w_scalar_kset order by key;
  key   | val 
--------+-----
 e_wsks | w
 z_wsks | y
(2 rows)

delete from db15_w_scalar_kset;
select * from db15_w_scalar_kset order by key;
 key | val 
-----+-----
(0 rows)

-- non-singleton set table no prefix no keyset
-- non-array case -- fails
create foreign table db15_w_set_nonarr(key text, val text)
       server localredis
       options (database '15', tabletype 'set');
insert into db15_w_set_nonarr values ('nkseta','{b,c,d}'), ('nksetc','{d,e,f}'),('nksete','{f,g,h}');
ERROR:  cannot insert into this type of Redis table - needs an array
/*
-- namespace too polluted for this case
create foreign table db15_w_set(key text, val text[])
       server localredis
       options (database '15', tabletype 'set');

select * from db15_w_set;

insert into db15_w_set values ('nkseta','{b,c,d}'), ('nksetc','{d,e,f}'),('nksete','{f,g,h}');

select * from db15_w_set;

delete from db15_w_set where key = 'nkseta';

select * from db15_w_set;

delete from db15_w_set;

select * from db15_w_set;

*/
-- non-singleton set table keyprefix
create foreign table db15_w_set_pfx(key text, val text[])
       server localredis
       options (database '15', tabletype 'set', tablekeyprefix 'w_set_');
select * from db15_w_set_pfx;
 key | val 
-----+-----
(0 rows)

insert into db15_w_set_pfx values ('w_set_a','{b,c,d}'), ('w_set_c','{d,e,f}'),('w_set_e','{f,g,h}');
insert into db15_w_set_pfx values ('x','{y}'); -- prefix error
ERROR:  key 'x' does not match table key prefix 'w_set_'
insert into db15_w_set_pfx values ('w_set_a','{x,y,z}'); -- dup error
ERROR:  key already exists: w_set_a
select key, atsort(val) as val from db15_w_set_pfx order by key;
   key   |   val   
---------+---------
 w_set_a | {b,c,d}
 w_set_c | {d,e,f}
 w_set_e | {f,g,h}
(3 rows)

delete from db15_w_set_pfx where key = 'w_set_a';
select key, atsort(val) as val from db15_w_set_pfx order by key;
   key   |   val   
---------+---------
 w_set_c | {d,e,f}
 w_set_e | {f,g,h}
(2 rows)

update db15_w_set_pfx set key = 'x' where key = 'w_set_c'; -- prefix err
ERROR:  key prefix condition violation: x
update db15_w_set_pfx set key = 'x', val = '{y}' where key = 'w_set_c'; -- prefix err
ERROR:  key prefix condition violation: x
update db15_w_set_pfx set key = 'w_set_x', val = '{x,y,z}' where key = 'w_set_c';
select key, atsort(val) as val from db15_w_set_pfx order by key;
   key   |   val   
---------+---------
 w_set_e | {f,g,h}
 w_set_x | {x,y,z}
(2 rows)

update db15_w_set_pfx set key = 'w_set_z' where key = 'w_set_x';
select key, atsort(val) as val from db15_w_set_pfx order by key;
   key   |   val   
---------+---------
 w_set_e | {f,g,h}
 w_set_z | {x,y,z}
(2 rows)

update db15_w_set_pfx set val = '{q,r,s}' where key = 'w_set_e';
select key, atsort(val) as val from db15_w_set_pfx order by key;
   key   |   val   
---------+---------
 w_set_e | {q,r,s}
 w_set_z | {x,y,z}
(2 rows)

delete from db15_w_set_pfx;
select key, atsort(val) as val from db15_w_set_pfx order by key;
 key | val 
-----+-----
(0 rows)

-- non-singleton set table keyset
create foreign table db15_w_set_kset(key text, val text[])
       server localredis
       options (database '15', tabletype 'set', tablekeyset 'w_set_kset');
select * from db15_w_set_kset;
 key | val 
-----+-----
(0 rows)

insert into db15_w_set_kset values ('a_wsk','{b,c,d}'), ('c_wsk','{d,e,f}'),('e_wsk','{f,g,h}');
insert into db15_w_set_kset values ('a_wsk','{x}'); -- dup error
ERROR:  key already exists: a_wsk
select key, atsort(val) as val from db15_w_set_kset order by key;
  key  |   val   
-------+---------
 a_wsk | {b,c,d}
 c_wsk | {d,e,f}
 e_wsk | {f,g,h}
(3 rows)

delete from db15_w_set_kset where key = 'a_wsk';
select key, atsort(val) as val from db15_w_set_kset order by key;
  key  |   val   
-------+---------
 c_wsk | {d,e,f}
 e_wsk | {f,g,h}
(2 rows)

update db15_w_set_kset set key = 'x_wsk', val = '{x,y,z}' where key = 'c_wsk';
select key, atsort(val) as val from db15_w_set_kset order by key;
  key  |   val   
-------+---------
 e_wsk | {f,g,h}
 x_wsk | {x,y,z}
(2 rows)

update db15_w_set_kset set key = 'z_wsk' where key = 'x_wsk';
select key, atsort(val) as val from db15_w_set_kset order by key;
  key  |   val   
-------+---------
 e_wsk | {f,g,h}
 z_wsk | {x,y,z}
(2 rows)

update db15_w_set_kset set val = '{q,r,s}' where key = 'e_wsk';
select key, atsort(val) as val from db15_w_set_kset order by key;
  key  |   val   
-------+---------
 e_wsk | {q,r,s}
 z_wsk | {x,y,z}
(2 rows)

delete from db15_w_set_kset;
select * from db15_w_set_kset;
 key | val 
-----+-----
(0 rows)

-- non-singleton list table keyprefix
create foreign table db15_w_list_pfx(key text, val text[])
       server localredis
       options (database '15', tabletype 'list', tablekeyprefix 'w_list_');
select * from db15_w_list_pfx;
 key | val 
-----+-----
(0 rows)

insert into db15_w_list_pfx values ('w_list_a','{b,c,d}'), ('w_list_c','{d,e,f}'),('w_list_e','{f,g,h}');
insert into db15_w_list_pfx values ('x','{y}'); -- prefix error
ERROR:  key 'x' does not match table key prefix 'w_list_'
insert into db15_w_list_pfx values ('w_list_a','{x,y,z}'); -- dup error
ERROR:  key already exists: w_list_a
select * from db15_w_list_pfx order by key;
   key    |   val   
----------+---------
 w_list_a | {b,c,d}
 w_list_c | {d,e,f}
 w_list_e | {f,g,h}
(3 rows)

delete from db15_w_list_pfx where key = 'w_list_a';
select * from db15_w_list_pfx order by key;
   key    |   val   
----------+---------
 w_list_c | {d,e,f}
 w_list_e | {f,g,h}
(2 rows)

update db15_w_list_pfx set key = 'x' where key = 'w_list_c'; -- prefix err
ERROR:  key prefix condition violation: x
update db15_w_list_pfx set key = 'x', val = '{y}' where key = 'w_list_c'; -- prefix err
ERROR:  key prefix condition violation: x
update db15_w_list_pfx set key = 'w_list_x', val = '{x,y,z}' where key = 'w_list_c';
select key, atsort(val) as val from db15_w_list_pfx order by key;
   key    |   val   
----------+---------
 w_list_e | {f,g,h}
 w_list_x | {x,y,z}
(2 rows)

update db15_w_list_pfx set key = 'w_list_z' where key = 'w_list_x';
select key, atsort(val) as val from db15_w_list_pfx order by key;
   key    |   val   
----------+---------
 w_list_e | {f,g,h}
 w_list_z | {x,y,z}
(2 rows)

update db15_w_list_pfx set val = '{q,r,s}' where key = 'w_list_e';
select key, atsort(val) as val from db15_w_list_pfx order by key;
   key    |   val   
----------+---------
 w_list_e | {q,r,s}
 w_list_z | {x,y,z}
(2 rows)

delete from db15_w_list_pfx;
select * from db15_w_list_pfx;
 key | val 
-----+-----
(0 rows)

-- non-singleton list table keyset
create foreign table db15_w_list_kset(key text, val text[])
       server localredis
       options (database '15', tabletype 'list', tablekeyset 'w_list_kset');
select * from db15_w_list_kset;
 key | val 
-----+-----
(0 rows)

insert into db15_w_list_kset values ('a_wlk','{b,c,d}'), ('c_wlk','{d,e,f}'),('e_wlk','{f,g,h}');
insert into db15_w_list_kset values ('a_wlk','{x}'); -- dup error
ERROR:  key already exists: a_wlk
select * from db15_w_list_kset order by key;
  key  |   val   
-------+---------
 a_wlk | {b,c,d}
 c_wlk | {d,e,f}
 e_wlk | {f,g,h}
(3 rows)

delete from db15_w_list_kset where key = 'a_wlk';
select * from db15_w_list_kset order by key;
  key  |   val   
-------+---------
 c_wlk | {d,e,f}
 e_wlk | {f,g,h}
(2 rows)

update db15_w_list_kset set key = 'x_wlk', val = '{x,y,z}' where key = 'c_wlk';
select key, atsort(val) as val from db15_w_list_kset order by key;
  key  |   val   
-------+---------
 e_wlk | {f,g,h}
 x_wlk | {x,y,z}
(2 rows)

update db15_w_list_kset set key = 'z_wlk' where key = 'x_wlk';
select key, atsort(val) as val from db15_w_list_kset order by key;
  key  |   val   
-------+---------
 e_wlk | {f,g,h}
 z_wlk | {x,y,z}
(2 rows)

update db15_w_list_kset set val = '{q,r,s}' where key = 'e_wlk';
select key, atsort(val) as val from db15_w_list_kset order by key;
  key  |   val   
-------+---------
 e_wlk | {q,r,s}
 z_wlk | {x,y,z}
(2 rows)

delete from db15_w_list_kset;
select * from db15_w_list_kset;
 key | val 
-----+-----
(0 rows)

-- non-singleton zset table keyprefix
create foreign table db15_w_zset_pfx(key text, val text[])
       server localredis
       options (database '15', tabletype 'zset', tablekeyprefix 'w_zset_');
select * from db15_w_zset_pfx;
 key | val 
-----+-----
(0 rows)

insert into db15_w_zset_pfx values ('w_zset_a','{b,c,d}'), ('w_zset_c','{d,e,f}'),('w_zset_e','{f,g,h}');
insert into db15_w_zset_pfx values ('x','{y}'); -- prefix error
ERROR:  key 'x' does not match table key prefix 'w_zset_'
insert into db15_w_zset_pfx values ('w_zset_a','{x,y,z}'); -- dup error
ERROR:  key already exists: w_zset_a
select * from db15_w_zset_pfx order by key;
   key    |   val   
----------+---------
 w_zset_a | {b,c,d}
 w_zset_c | {d,e,f}
 w_zset_e | {f,g,h}
(3 rows)

delete from db15_w_zset_pfx where key = 'w_zset_a';
select * from db15_w_zset_pfx order by key;
   key    |   val   
----------+---------
 w_zset_c | {d,e,f}
 w_zset_e | {f,g,h}
(2 rows)

update db15_w_zset_pfx set key = 'x' where key = 'w_zset_c'; -- prefix err
ERROR:  key prefix condition violation: x
update db15_w_zset_pfx set key = 'x', val = '{y}' where key = 'w_zset_c'; -- prefix err
ERROR:  key prefix condition violation: x
update db15_w_zset_pfx set key = 'w_zset_x', val = '{x,y,z}' where key = 'w_zset_c';
select key, atsort(val) as val from db15_w_zset_pfx order by key;
   key    |   val   
----------+---------
 w_zset_e | {f,g,h}
 w_zset_x | {x,y,z}
(2 rows)

update db15_w_zset_pfx set key = 'w_zset_z' where key = 'w_zset_x';
select key, atsort(val) as val from db15_w_zset_pfx order by key;
   key    |   val   
----------+---------
 w_zset_e | {f,g,h}
 w_zset_z | {x,y,z}
(2 rows)

update db15_w_zset_pfx set val = '{q,r,s}' where key = 'w_zset_e';
select key, atsort(val) as val from db15_w_zset_pfx order by key;
   key    |   val   
----------+---------
 w_zset_e | {q,r,s}
 w_zset_z | {x,y,z}
(2 rows)

delete from db15_w_zset_pfx;
select * from db15_w_zset_pfx;
 key | val 
-----+-----
(0 rows)

-- non-singleton zset table keyset
create foreign table db15_w_zset_kset(key text, val text[])
       server localredis
       options (database '15', tabletype 'zset', tablekeyset 'w_zset_kset');
select * from db15_w_zset_kset;
 key | val 
-----+-----
(0 rows)

insert into db15_w_zset_kset values ('a_wzk','{b,c,d}'), ('c_wzk','{d,e,f}'),('e_wzk','{f,g,h}');
insert into db15_w_zset_kset values ('a_wzk','{x}'); -- dup error
ERROR:  key already exists: a_wzk
select * from db15_w_zset_kset order by key;
  key  |   val   
-------+---------
 a_wzk | {b,c,d}
 c_wzk | {d,e,f}
 e_wzk | {f,g,h}
(3 rows)

delete from db15_w_zset_kset where key = 'a_wzk';
select * from db15_w_zset_kset order by key;
  key  |   val   
-------+---------
 c_wzk | {d,e,f}
 e_wzk | {f,g,h}
(2 rows)

update db15_w_zset_kset set key = 'x_wlk', val = '{x,y,z}' where key = 'c_wzk';
select key, atsort(val) as val from db15_w_zset_kset order by key;
  key  |   val   
-------+---------
 e_wzk | {f,g,h}
 x_wlk | {x,y,z}
(2 rows)

update db15_w_zset_kset set key = 'z_wzk' where key = 'x_wzk';
select key, atsort(val) as val from db15_w_zset_kset order by key;
  key  |   val   
-------+---------
 e_wzk | {f,g,h}
 x_wlk | {x,y,z}
(2 rows)

update db15_w_zset_kset set val = '{q,r,s}' where key = 'e_wzk';
select key, atsort(val) as val from db15_w_zset_kset order by key;
  key  |   val   
-------+---------
 e_wzk | {q,r,s}
 x_wlk | {x,y,z}
(2 rows)

delete from db15_w_zset_kset;
select * from db15_w_zset_kset;
 key | val 
-----+-----
(0 rows)

-- non-singleton hash table prefix
create foreign table db15_w_hash_pfx(key text, val text[])
       server localredis
       options (database '15', tabletype 'hash', tablekeyprefix 'w_hash_');
select * from db15_w_hash_pfx;
 key | val 
-----+-----
(0 rows)

insert into db15_w_hash_pfx values ('w_hash_e','{f,g,h}'); -- error
ERROR:  cannot decompose odd number of items into a Redis hash
insert into db15_w_hash_pfx values ('w_hash_e','{}'); -- error
ERROR:  cannot store empty list in a Redis table
insert into db15_w_hash_pfx values ('w_hash_a','{b,c,d,e}'), ('w_hash_c','{f,g,h,i}'),('w_hash_e','{j,k}');
insert into db15_w_hash_pfx values ('x','{y,z}'); -- prefix error
ERROR:  key 'x' does not match table key prefix 'w_hash_'
insert into db15_w_hash_pfx values ('w_hash_a','{y,z}'); -- dup error
ERROR:  key already exists: w_hash_a
select * from db15_w_hash_pfx order by key;
   key    |    val    
----------+-----------
 w_hash_a | {b,c,d,e}
 w_hash_c | {f,g,h,i}
 w_hash_e | {j,k}
(3 rows)

delete from db15_w_hash_pfx where key = 'w_hash_a';
select * from db15_w_hash_pfx order by key;
   key    |    val    
----------+-----------
 w_hash_c | {f,g,h,i}
 w_hash_e | {j,k}
(2 rows)

update db15_w_hash_pfx set key = 'x' where key = 'w_hash_c'; -- prefix err
ERROR:  key prefix condition violation: x
update db15_w_hash_pfx set key = 'x', val = '{y,z}' where key = 'w_hash_c'; -- prefix err
ERROR:  key prefix condition violation: x
update db15_w_hash_pfx set key = 'w_hash_x', val = '{x,y,z}' where key = 'w_hash_c'; -- err
ERROR:  cannot decompose odd number of items into a Redis hash
update db15_w_hash_pfx set key = 'w_hash_x', val = '{w,x,y,z}' where key = 'w_hash_c';
select key, val from db15_w_hash_pfx order by key;
   key    |    val    
----------+-----------
 w_hash_e | {j,k}
 w_hash_x | {w,x,y,z}
(2 rows)

update db15_w_hash_pfx set key = 'w_hash_z' where key = 'w_hash_x';
select key, val from db15_w_hash_pfx order by key;
   key    |    val    
----------+-----------
 w_hash_e | {j,k}
 w_hash_z | {w,x,y,z}
(2 rows)

update db15_w_hash_pfx set val = '{q,r,s}' where key = 'w_hash_e';
ERROR:  cannot decompose odd number of items into a Redis hash
select key, val from db15_w_hash_pfx order by key;
   key    |    val    
----------+-----------
 w_hash_e | {j,k}
 w_hash_z | {w,x,y,z}
(2 rows)

delete from db15_w_hash_pfx;
select * from db15_w_hash_pfx;
 key | val 
-----+-----
(0 rows)

--non-singleton hash table keyset
create foreign table db15_w_hash_kset(key text, val text[])
       server localredis
       options (database '15', tabletype 'hash', tablekeyset 'w_hash_kset');
select * from db15_w_hash_kset;
 key | val 
-----+-----
(0 rows)

insert into db15_w_hash_pfx values ('e_whk','{f,g,h}'); -- error
ERROR:  key 'e_whk' does not match table key prefix 'w_hash_'
insert into db15_w_hash_pfx values ('e_whk','{}'); -- error
ERROR:  key 'e_whk' does not match table key prefix 'w_hash_'
insert into db15_w_hash_kset values ('a_whk','{b,c,d,e}'), ('c_whk','{f,g,h,i}'),('e_whk','{j,k}');
insert into db15_w_hash_kset values ('a_whk','{x,y}'); -- dup error
ERROR:  key already exists: a_whk
select * from db15_w_hash_kset order by key;
  key  |    val    
-------+-----------
 a_whk | {b,c,d,e}
 c_whk | {f,g,h,i}
 e_whk | {j,k}
(3 rows)

delete from db15_w_hash_kset where key = 'a_whk';
select * from db15_w_hash_kset order by key;
  key  |    val    
-------+-----------
 c_whk | {f,g,h,i}
 e_whk | {j,k}
(2 rows)

update db15_w_hash_kset set key = 'x_whk', val = '{w,x,y,z}' where key = 'c_whk';
select key, val from db15_w_hash_kset order by key;
  key  |    val    
-------+-----------
 e_whk | {j,k}
 x_whk | {w,x,y,z}
(2 rows)

update db15_w_hash_kset set key = 'z_whk' where key = 'x_whk';
select key, val from db15_w_hash_kset order by key;
  key  |    val    
-------+-----------
 e_whk | {j,k}
 z_whk | {w,x,y,z}
(2 rows)

update db15_w_hash_kset set val = '{q,r}' where key = 'e_whk';
select key, val from db15_w_hash_kset order by key;
  key  |    val    
-------+-----------
 e_whk | {q,r}
 z_whk | {w,x,y,z}
(2 rows)

delete from db15_w_hash_kset;
select * from db15_w_hash_kset;
 key | val 
-----+-----
(0 rows)

-- now clean up for the cursor tests
\! redis-cli < test/sql/redis_clean
OK
OK
-- cursor tests
create foreign table db15bigprefixscalar (
       key text not null,
       val text
)
server localredis
options (database '15', tablekeyprefix 'w_scalar_');
create foreign table db15bigkeysetscalar (
       key text not null,
       val text
)
server localredis
options (database '15', tablekeyset 'w_kset');
insert into db15
select 'junk' || x, 'junk'
from generate_series(1,10000) as x;
insert into db15bigprefixscalar
select 'w_scalar_' || x::text, 'val ' || x::text
from generate_series (1,10000) as x;
insert into db15bigkeysetscalar
select 'key_' || x::text, 'val ' || x::text
from generate_series (1,10000) as x;
insert into db15
select 'junk' || x, 'junk'
from generate_series(10001, 20000) as x;
insert into db15bigprefixscalar
select 'w_scalar_' || x::text, 'val ' || x::text
from generate_series (10001, 20000) as x;
insert into db15bigkeysetscalar
select 'key_' || x::text, 'val ' || x::text
from generate_series (10001, 20000) as x;
select count(*) from   db15;
 count 
-------
 60000
(1 row)

select count(*) from db15bigprefixscalar;
 count 
-------
 20000
(1 row)

select count(*) from db15bigkeysetscalar;
 count 
-------
 20000
(1 row)

-- UPDATE ... FROM / DELETE ... USING against a foreign table, including
-- via a forced merge join on the key column. Regression test for:
-- - EXPLAIN of INSERT/UPDATE/DELETE (no ANALYZE) must not crash the backend
-- - a merge join on the key column must not fail with
--   "could not find pathkey item to sort" (caused by a collation mismatch
--   between the key column's row-identity Var and its plain references)
create foreign table db15_joinupd(key text, val text)
       server localredis
       options (tablekeyprefix 'joinupd_', database '15');
insert into db15_joinupd values
       ('joinupd_foo', 'old1'), ('joinupd_bar', 'old2'), ('joinupd_baz', 'old3');
create table joinupd_src(key text, val text);
insert into joinupd_src values ('joinupd_foo', 'new1'), ('joinupd_bar', 'new2');
explain (costs off) update db15_joinupd set val = 'x' where key = 'joinupd_foo';
                 QUERY PLAN                  
---------------------------------------------
 Update on db15_joinupd
   ->  Foreign Scan on db15_joinupd
         Filter: (key = 'joinupd_foo'::text)
(3 rows)

explain (costs off) delete from db15_joinupd where key = 'joinupd_foo';
                 QUERY PLAN                  
---------------------------------------------
 Delete on db15_joinupd
   ->  Foreign Scan on db15_joinupd
         Filter: (key = 'joinupd_foo'::text)
(3 rows)

explain (costs off) insert into db15_joinupd values ('joinupd_new', 'v');
       QUERY PLAN       
------------------------
 Insert on db15_joinupd
   ->  Result
(2 rows)

set enable_hashjoin = off;
set enable_nestloop = off;
explain (costs off) update db15_joinupd r set val = n.val
       from joinupd_src n where r.key = n.key;
                    QUERY PLAN                    
--------------------------------------------------
 Update on db15_joinupd r
   ->  Merge Join
         Merge Cond: (n.key = r.key)
         ->  Sort
               Sort Key: n.key
               ->  Seq Scan on joinupd_src n
         ->  Sort
               Sort Key: r.key
               ->  Foreign Scan on db15_joinupd r
(9 rows)

update db15_joinupd r set val = n.val
       from joinupd_src n where r.key = n.key;
select * from db15_joinupd order by key;
     key     | val  
-------------+------
 joinupd_bar | new2
 joinupd_baz | old3
 joinupd_foo | new1
(3 rows)

delete from db15_joinupd r using joinupd_src n where r.key = n.key;
select * from db15_joinupd order by key;
     key     | val  
-------------+------
 joinupd_baz | old3
(1 row)

reset enable_hashjoin;
reset enable_nestloop;
drop table joinupd_src;
drop foreign table db15_joinupd;
-- NULL key or value must be rejected with an error, not crash the backend.
create foreign table db15_w_nulls_hash(key text, val text)
       server localredis
       options (singleton_key 'w_nulls_hash', tabletype 'hash', database '15');
insert into db15_w_nulls_hash values (null, 'v');
ERROR:  cannot insert NULL key into a Redis table
insert into db15_w_nulls_hash values ('k', null);
ERROR:  cannot insert NULL value into a Redis table
create foreign table db15_w_nulls_zset(val text, score numeric)
       server localredis
       options (singleton_key 'w_nulls_zset', tabletype 'zset', database '15');
insert into db15_w_nulls_zset values ('m', null);
ERROR:  cannot insert NULL value into a Redis table
create foreign table db15_w_nulls_multi(key text, val text)
       server localredis
       options (tabletype 'hash', database '15');
insert into db15_w_nulls_multi values (null, 'v');
ERROR:  cannot insert NULL key into a Redis table
insert into db15_w_nulls_multi values ('k', null);
ERROR:  cannot insert NULL into a Redis table
drop foreign table db15_w_nulls_hash;
drop foreign table db15_w_nulls_zset;
drop foreign table db15_w_nulls_multi;
-- a self-join opens two concurrent ForeignScans sharing the same cache key
-- (same connection options); results must be correct regardless.
-- ALTER SERVER (even a no-op value change) exercises the connection cache's
-- invalidation path; queries against the table must keep working afterwards.
create foreign table db15_cachetest(key text, value text)
       server localredis
       options (database '15', tablekeyprefix 'cachetest_');
insert into db15_cachetest values
       ('cachetest_a', '1'), ('cachetest_b', '2'), ('cachetest_c', '3');
select count(*) from db15_cachetest t1 join db15_cachetest t2
       on t1.key <> t2.key;
 count 
-------
     6
(1 row)

alter server localredis options (add address '127.0.0.1');
select value from db15_cachetest where key = 'cachetest_a';
 value 
-------
 1
(1 row)

drop foreign table db15_cachetest;
-- A tablekeyprefix is a literal prefix, not a glob pattern. It is embedded in
-- the KEYS/SCAN MATCH pattern used to find the table's keys, so any glob
-- metacharacter in it must be escaped or the table returns keys belonging to
-- other prefixes.
\! redis-cli -n 15 set 'g*b_star'  v > /dev/null
\! redis-cli -n 15 set 'gXb_other' v > /dev/null
\! redis-cli -n 15 set 'gzzb_two'  v > /dev/null
create foreign table db15_glob_star(key text, value text)
       server localredis
       options (database '15', tablekeyprefix 'g*b');
select key from db15_glob_star order by key;
   key    
----------
 g*b_star
(1 row)

\! redis-cli -n 15 set 'q?b_quest' v > /dev/null
\! redis-cli -n 15 set 'qQb_other' v > /dev/null
create foreign table db15_glob_quest(key text, value text)
       server localredis
       options (database '15', tablekeyprefix 'q?b');
select key from db15_glob_quest order by key;
    key    
-----------
 q?b_quest
(1 row)

\! redis-cli -n 15 set 'c[xy]b_class' v > /dev/null
\! redis-cli -n 15 set 'cxb_other'    v > /dev/null
create foreign table db15_glob_class(key text, value text)
       server localredis
       options (database '15', tablekeyprefix 'c[xy]b');
select key from db15_glob_class order by key;
     key      
--------------
 c[xy]b_class
(1 row)

-- an ordinary prefix with no metacharacters must be unaffected
create foreign table db15_glob_plain(key text, value text)
       server localredis
       options (database '15', tablekeyprefix 'gzz');
select key from db15_glob_plain order by key;
   key    
----------
 gzzb_two
(1 row)

drop foreign table db15_glob_star;
drop foreign table db15_glob_quest;
drop foreign table db15_glob_class;
drop foreign table db15_glob_plain;
-- An aborted statement must not wedge the backend's Redis connection.
-- The abort skips the executor End nodes, so anything the FDW expects those
-- nodes to clean up is never cleaned up; a connection cache that relies on
-- them will hand out a dead socket for the rest of the session.
create foreign table db15_conntest(key text, value text)
       server localredis
       options (database '15', tablekeyprefix 'conntest_');
insert into db15_conntest values ('conntest_a', 'notanumber');
-- abort a statement partway through a scan
select value::int from db15_conntest;
ERROR:  invalid input syntax for type integer: "notanumber"
-- Kill the backend's cached Redis connection from the server side. CLIENT
-- KILL defaults to SKIPME yes, so redis-cli spares its own connection. Like
-- the rest of this suite, this assumes redis-cli runs on the same host as
-- the PostgreSQL server.
\! redis-cli CLIENT KILL TYPE normal > /dev/null
-- must reconnect rather than reuse the dead socket
select value from db15_conntest;
   value    
------------
 notanumber
(1 row)

-- A connection lost mid-transaction is re-established without ending the
-- transaction, and a subtransaction abort needs no special handling.
begin;
select value from db15_conntest;
   value    
------------
 notanumber
(1 row)

\! redis-cli CLIENT KILL TYPE normal > /dev/null
savepoint s;
-- the error text comes from hiredis and varies by version, so normalise it
do $$
begin
  perform value from db15_conntest;
  raise notice 'unexpectedly succeeded on a dead socket';
exception when others then
  raise notice 'connection loss detected';
end
$$;
NOTICE:  connection loss detected
rollback to s;
select value from db15_conntest;
   value    
------------
 notanumber
(1 row)

commit;
drop foreign table db15_conntest;
-- A username with no password must be rejected. Authentication is gated on
-- the password being set, so accepting a lone username would silently connect
-- unauthenticated while the operator believed ACL auth was configured.
create server authtest foreign data wrapper redis_fdw;
create user mapping for public server authtest options (username 'u');
ERROR:  option "username" requires option "password"
-- both together are fine
create user mapping for public server authtest options (username 'u', password 'p');
-- and dropping just the password must be rejected too
alter user mapping for public server authtest options (drop password);
ERROR:  option "username" requires option "password"
drop user mapping for public server authtest;
-- the legacy password-only form is still accepted
create user mapping for public server authtest options (password 'p');
drop user mapping for public server authtest;
drop server authtest;
-- ACL authentication end to end. The suite's default Redis user is
-- unauthenticated, so the test can provision its own ACL user. "reset" makes
-- the setup idempotent: a plain SETUSER merges into an existing user rather
-- than replacing it, so a run that aborted before cleaning up would otherwise
-- leave a user with two passwords and stale rules.
\! redis-cli ACL SETUSER fdwtest reset on '>secret' '~*' '+@all' > /dev/null
\! redis-cli -n 15 set acltest_k hello > /dev/null
create server aclsrv foreign data wrapper redis_fdw;
create user mapping for public server aclsrv
       options (username 'fdwtest', password 'secret');
create foreign table db15_acl(key text, value text)
       server aclsrv
       options (database '15', tablekeyprefix 'acltest_');
select * from db15_acl order by key;
    key    | value 
-----------+-------
 acltest_k | hello
(1 row)

-- A wrong password must be refused. This is the case that carries the weight:
-- were AUTH skipped altogether, the connection would fall back to the
-- unauthenticated default user and the query would succeed. The message comes
-- from the server and is not a stable contract, so assert only the failure.
create server aclbad foreign data wrapper redis_fdw;
create user mapping for public server aclbad
       options (username 'fdwtest', password 'wrongpw');
create foreign table db15_aclbad(key text, value text)
       server aclbad
       options (database '15', tablekeyprefix 'acltest_');
do $$
begin
  perform * from db15_aclbad;
  raise notice 'unexpectedly connected with a bad password';
exception when others then
  raise notice 'authentication refused as expected';
end
$$;
NOTICE:  authentication refused as expected
drop foreign table db15_acl;
drop foreign table db15_aclbad;
drop server aclsrv cascade;
NOTICE:  drop cascades to user mapping for public on server aclsrv
drop server aclbad cascade;
NOTICE:  drop cascades to user mapping for public on server aclbad
\! redis-cli ACL DELUSER fdwtest > /dev/null
-- all done, so now blow everything in the db away again
\! redis-cli < test/sql/redis_clean
OK
OK
-- =====================================================
-- bytea column tests
-- =====================================================
-- Test that bytea columns work correctly for storing binary data
-- including data with embedded NUL bytes
-- singleton scalar table with bytea value
create foreign table db15_bytea_scalar(val bytea)
       server localredis
       options (singleton_key 'bytea_scalar', database '15');
select * from db15_bytea_scalar;
 val 
-----
(0 rows)

-- insert binary data with embedded NUL bytes
insert into db15_bytea_scalar values (E'hello\\000world'::bytea);
select * from db15_bytea_scalar;
           val            
--------------------------
 \x68656c6c6f00776f726c64
(1 row)

select length(val), val from db15_bytea_scalar;
 length |           val            
--------+--------------------------
     11 | \x68656c6c6f00776f726c64
(1 row)

-- update with different binary data
update db15_bytea_scalar set val = E'binary\\000data\\000here'::bytea;
select length(val), val from db15_bytea_scalar;
 length |                val                 
--------+------------------------------------
     16 | \x62696e61727900646174610068657265
(1 row)

delete from db15_bytea_scalar;
select * from db15_bytea_scalar;
 val 
-----
(0 rows)

-- non-singleton scalar table with bytea value column
create foreign table db15_bytea_scalar_ns(key text, val bytea)
       server localredis
       options (database '15', tablekeyprefix 'bscalar_');
select * from db15_bytea_scalar_ns;
 key | val 
-----+-----
(0 rows)

insert into db15_bytea_scalar_ns values
    ('bscalar_a', E'binary\\000a'::bytea),
    ('bscalar_b', E'binary\\000b'::bytea);
select key, length(val), val from db15_bytea_scalar_ns order by key;
    key    | length |        val         
-----------+--------+--------------------
 bscalar_a |      8 | \x62696e6172790061
 bscalar_b |      8 | \x62696e6172790062
(2 rows)

update db15_bytea_scalar_ns set val = E'updated\\000val'::bytea where key = 'bscalar_a';
select key, length(val), val from db15_bytea_scalar_ns order by key;
    key    | length |           val            
-----------+--------+--------------------------
 bscalar_a |     11 | \x757064617465640076616c
 bscalar_b |      8 | \x62696e6172790062
(2 rows)

delete from db15_bytea_scalar_ns where key = 'bscalar_a';
select key, length(val), val from db15_bytea_scalar_ns order by key;
    key    | length |        val         
-----------+--------+--------------------
 bscalar_b |      8 | \x62696e6172790062
(1 row)

delete from db15_bytea_scalar_ns;
select * from db15_bytea_scalar_ns;
 key | val 
-----+-----
(0 rows)

-- singleton hash table with bytea value column (key must be text)
create foreign table db15_bytea_hash(key text, val bytea)
       server localredis
       options (singleton_key 'bytea_hash', tabletype 'hash', database '15');
select * from db15_bytea_hash;
 key | val 
-----+-----
(0 rows)

insert into db15_bytea_hash values
    ('field1', E'hash\\000val1'::bytea),
    ('field2', E'hash\\000val2'::bytea);
select key, length(val), val from db15_bytea_hash order by key;
  key   | length |         val          
--------+--------+----------------------
 field1 |      9 | \x686173680076616c31
 field2 |      9 | \x686173680076616c32
(2 rows)

update db15_bytea_hash set val = E'new\\000hash\\000val'::bytea where key = 'field1';
select key, length(val), val from db15_bytea_hash order by key;
  key   | length |            val             
--------+--------+----------------------------
 field1 |     12 | \x6e657700686173680076616c
 field2 |      9 | \x686173680076616c32
(2 rows)

delete from db15_bytea_hash where key = 'field2';
select key, length(val), val from db15_bytea_hash order by key;
  key   | length |            val             
--------+--------+----------------------------
 field1 |     12 | \x6e657700686173680076616c
(1 row)

delete from db15_bytea_hash;
select * from db15_bytea_hash;
 key | val 
-----+-----
(0 rows)

-- test that bytea key column in hash is rejected
create foreign table db15_bytea_hash_bad(key bytea, val text)
       server localredis
       options (singleton_key 'bytea_hash_bad', tabletype 'hash', database '15');
insert into db15_bytea_hash_bad values (E'key'::bytea, 'val');
ERROR:  bytea not supported for hash field column
-- singleton set table with bytea member
create foreign table db15_bytea_set(member bytea)
       server localredis
       options (singleton_key 'bytea_set', tabletype 'set', database '15');
select * from db15_bytea_set;
 member 
--------
(0 rows)

insert into db15_bytea_set values
    (E'set\\000member1'::bytea),
    (E'set\\000member2'::bytea),
    (E'set\\000member3'::bytea);
select length(member), member from db15_bytea_set order by member;
 length |          member          
--------+--------------------------
     11 | \x736574006d656d62657231
     11 | \x736574006d656d62657232
     11 | \x736574006d656d62657233
(3 rows)

delete from db15_bytea_set where member = E'set\\000member2'::bytea;
select length(member), member from db15_bytea_set order by member;
 length |          member          
--------+--------------------------
     11 | \x736574006d656d62657231
     11 | \x736574006d656d62657233
(2 rows)

-- update member
update db15_bytea_set set member = E'set\\000updated'::bytea where member = E'set\\000member1'::bytea;
select length(member), member from db15_bytea_set order by member;
 length |          member          
--------+--------------------------
     11 | \x736574006d656d62657233
     11 | \x7365740075706461746564
(2 rows)

delete from db15_bytea_set;
select * from db15_bytea_set;
 member 
--------
(0 rows)

-- singleton zset table with bytea member and scores
create foreign table db15_bytea_zset(member bytea, score numeric)
       server localredis
       options (singleton_key 'bytea_zset', tabletype 'zset', database '15');
select * from db15_bytea_zset;
 member | score 
--------+-------
(0 rows)

insert into db15_bytea_zset values
    (E'zset\\000m1'::bytea, 1),
    (E'zset\\000m2'::bytea, 2),
    (E'zset\\000m3'::bytea, 3);
select length(member), member, score from db15_bytea_zset order by score;
 length |      member      | score 
--------+------------------+-------
      7 | \x7a736574006d31 |     1
      7 | \x7a736574006d32 |     2
      7 | \x7a736574006d33 |     3
(3 rows)

delete from db15_bytea_zset where member = E'zset\\000m2'::bytea;
select length(member), member, score from db15_bytea_zset order by score;
 length |      member      | score 
--------+------------------+-------
      7 | \x7a736574006d31 |     1
      7 | \x7a736574006d33 |     3
(2 rows)

update db15_bytea_zset set score = 10 where member = E'zset\\000m1'::bytea;
select length(member), member, score from db15_bytea_zset order by score;
 length |      member      | score 
--------+------------------+-------
      7 | \x7a736574006d33 |     3
      7 | \x7a736574006d31 |    10
(2 rows)

delete from db15_bytea_zset;
select * from db15_bytea_zset;
 member | score 
--------+-------
(0 rows)

-- non-singleton set table with bytea[] array column
create foreign table db15_bytea_set_arr(key text, val bytea[])
       server localredis
       options (database '15', tabletype 'set', tablekeyprefix 'bset_');
select * from db15_bytea_set_arr;
 key | val 
-----+-----
(0 rows)

insert into db15_bytea_set_arr values
    ('bset_a', array[E'a\\000'::bytea, E'b\\000'::bytea, E'c\\000'::bytea]);
select key, val from db15_bytea_set_arr order by key;
  key   |               val               
--------+---------------------------------
 bset_a | {"\\x6100","\\x6200","\\x6300"}
(1 row)

delete from db15_bytea_set_arr;
select * from db15_bytea_set_arr;
 key | val 
-----+-----
(0 rows)

-- non-singleton zset table with bytea[] array column
create foreign table db15_bytea_zset_arr(key text, val bytea[])
       server localredis
       options (database '15', tabletype 'zset', tablekeyprefix 'bzset_');
select * from db15_bytea_zset_arr;
 key | val 
-----+-----
(0 rows)

insert into db15_bytea_zset_arr values
    ('bzset_a', array[E'x\\000'::bytea, E'y\\000'::bytea, E'z\\000'::bytea]);
select key, val from db15_bytea_zset_arr order by key;
   key   |               val               
---------+---------------------------------
 bzset_a | {"\\x7800","\\x7900","\\x7a00"}
(1 row)

delete from db15_bytea_zset_arr;
select * from db15_bytea_zset_arr;
 key | val 
-----+-----
(0 rows)

-- singleton list table with bytea value
-- note: UPDATE and DELETE not supported for list tables (Redis API limitation)
create foreign table db15_bytea_list(val bytea)
       server localredis
       options (singleton_key 'bytea_list', tabletype 'list', database '15');
select * from db15_bytea_list;
 val 
-----
(0 rows)

insert into db15_bytea_list values
    (E'list\\000item1'::bytea),
    (E'list\\000item2'::bytea),
    (E'list\\000item3'::bytea);
select length(val), val from db15_bytea_list;
 length |          val           
--------+------------------------
     10 | \x6c697374006974656d31
     10 | \x6c697374006974656d32
     10 | \x6c697374006974656d33
(3 rows)

-- clean up bytea tests
\! redis-cli < test/sql/redis_clean
OK
OK
